publishedTimeText,simpleText,votes,author,isReply,isHearted,isPinned,isPaid,paidAmount,isSponsor,sponsorshipMonths
1 month ago,kameranya jernih banget bagus umma tapi kaya ada efek melengkung² gitu gambarnya mungkin bisa dibenerin umma biar tambah bagus?,6,@Yumitachill,FALSE,FALSE,FALSE,FALSE,,FALSE,
1 month ago,mama mega senengg bgt bisa pke kamera dri pak bambang  bagus hasilnya umma love :),6,@ilhambintangsatria,FALSE,FALSE,FALSE,FALSE,,FALSE,
1 month ago,"keren bgt parenting umma, si rutsuki dibiarin buat ikut masak tp tetep dijaga biar ritsuki bisa explore  :)",6,@muti7512,FALSE,FALSE,FALSE,FALSE,,FALSE,
1 month ago,yuhuuuu,5,@inggitasikaa,FALSE,FALSE,FALSE,FALSE,,FALSE,
1 month ago,Grecepp ummaaa,5,@almiracalya,FALSE,FALSE,FALSE,FALSE,,FALSE,
1 month ago,Gercepp mama mega,5,@vaadllh.13,FALSE,FALSE,FALSE,FALSE,,FALSE,
1 month ago,ritsuki kaya marshaa lucu banget anak umaa??,5,@imeyelzaa,FALSE,FALSE,FALSE,FALSE,,FALSE,
1 month ago,akuu sii paling gercepp wkkk,5,@arlitaadevii9933,FALSE,FALSE,FALSE,FALSE,,FALSE,
1 month ago,Gercep ummaaa SM BESTie semua,5,@Faaa929,FALSE,FALSE,FALSE,FALSE,,FALSE,
1 month ago,Si paling grecep manh nih ??,5,@Ritsuki_fans307,FALSE,FALSE,FALSE,FALSE,,FALSE,
1 month ago,"Itu kameramennya Umma siapa ya baru liat, apa sodara apa cuma orang Indonesia kerja sama Umma?",5,@sekarwahyuningtiyas1541,FALSE,FALSE,FALSE,FALSE,,FALSE,
1 month ago, @sekarwahyuningtiyas1541  dia kerja di japan pas weekend libur,3,@Ueno_family,TRUE,FALSE,FALSE,FALSE,,FALSE,
1 month ago," @Ueno_family  MasyaAllah senengnya dibales sama Umma, sehat dan bahagia selalu ya Umma, Papa, Mas Nat dan Adik. Videonya selalu aku tonton kalo mau makan, kalo ga nonton video Umma ga akan mulai makan??",0,@sekarwahyuningtiyas1541,TRUE,FALSE,FALSE,FALSE,,FALSE,
1 month ago,Makasih ya mama mega bikin vlog gini jadi nemenin aku ga kesepian lagi setiap makan dikos sendirian ??,5,@dewipuspitaningrum7286,FALSE,FALSE,FALSE,FALSE,,FALSE,
1 month ago,Tim gercepp umaa?,4,@salmaramadhania3527,FALSE,FALSE,FALSE,FALSE,,FALSE,
1 month ago,Yang di tunggu² udah muncul nihh,4,@trihanawulandari3066,FALSE,FALSE,FALSE,FALSE,,FALSE,
1 month ago,Hii umma absen yg gercep??,4,@FadiyahNasywah,FALSE,FALSE,FALSE,FALSE,,FALSE,
1 month ago,"Gercep ummaaa, sehat selalu yaaaa?",4,@CattyIslamic,FALSE,FALSE,FALSE,FALSE,,FALSE,
1 month ago,Gercep umma dapat ritsuki yaaa,4,@FaniFani-o1t,FALSE,FALSE,FALSE,FALSE,,FALSE,
1 month ago,Gercep umaa??,4,@NabillaPutri021,FALSE,FALSE,FALSE,FALSE,,FALSE,
1 month ago,semoga sehat selalu umma dan sekeluarga??,4,@kukurara654,FALSE,FALSE,FALSE,FALSE,,FALSE,
1 month ago,GERCEP UMA,4,@PutriNurAisyah-hz6ye,FALSE,FALSE,FALSE,FALSE,,FALSE,
1 month ago,"sesuai prediksi, buka yutub pas umma br upload",4,@kiranifitria,FALSE,FALSE,FALSE,FALSE,,FALSE,
1 month ago,Keren wkt nonton baru sejuta skrg uda mau 2jt aja.   Balita trhitz 2024??,4,@user-eh9ox8py5y,FALSE,FALSE,FALSE,FALSE,,FALSE,
1 month ago,Liat si mentel Ritsuki.....gemesin poolllll cantik..lucu....Natsuki jg sayang adeknya....bolak balik bukain wadah ttp sabar ....love u all?????,4,@ninomayang8577,FALSE,FALSE,FALSE,FALSE,,FALSE,
1 month ago (edited),"Apresiasi untuk Umma udah mencoba nggunain kamera baru, gapapa gapapa kalo masih ada kurang2 namanya masih belajar biar next terbiasa dan kualitas lebih bagus.",4,@Angga16794,FALSE,FALSE,FALSE,FALSE,,FALSE,
1 month ago (edited),"20:39 salfok sama kaos dalem adik, kok talinya sampe ke ketek gitu too rit??????????
21:28 pas ini liat sebelahnyaa bener tapi sebelahnyaa melorot sampe ke ketek????",4,@fitriindriani8971,FALSE,FALSE,FALSE,FALSE,,FALSE,
1 month ago,"Ummaaaa, masha allah aku sudah recook, enak sekaliii umma, di makan hangat2?? cuman ga pakai baking soda, soalnya kalo beli hrs yg 1 botol, kebanyakan umma nanti eman2, hehe soale jrg masak?? terima kasih umma resepnya ruaarrr biasaaa????",4,@aratakarai,FALSE,FALSE,FALSE,FALSE,,FALSE,
1 month ago,Kualitas kameranya bikin ritsuki keliatan makin gemes. Ya Allah pen uyel2 adikkkkk????????????????,4,@sblv31,FALSE,FALSE,FALSE,FALSE,,FALSE,
1 month ago,Gercep,3,@AlyaPutri-yh9vp,FALSE,FALSE,FALSE,FALSE,,FALSE,
1 month ago,Tim gercep,3,@dwoercenell,FALSE,FALSE,FALSE,FALSE,,FALSE,
1 month ago,Gercep nih,3,@DarrelDevenWiratara,FALSE,FALSE,FALSE,FALSE,,FALSE,
1 month ago,gerecepp,3,@ayularasati2468,FALSE,FALSE,FALSE,FALSE,,FALSE,
1 month ago,gercep,3,@kikoTwT,FALSE,FALSE,FALSE,FALSE,,FALSE,
1 month ago (edited),Gercep umma semangatt,3,@Lyndd22,FALSE,FALSE,FALSE,FALSE,,FALSE,
1 month ago,Gercep ummaa,3,@glxsy_bila,FALSE,FALSE,FALSE,FALSE,,FALSE,
1 month ago,Gercep bes,3,@RiskaMaulia-kr9lq,FALSE,FALSE,FALSE,FALSE,,FALSE,
1 month ago,Timm gercep man nih,3,@batambatam4040,FALSE,FALSE,FALSE,FALSE,,FALSE,
1 month ago,Tim gercep umma,3,@user-gu7qv3pm5z,FALSE,FALSE,FALSE,FALSE,,FALSE,
1 month ago,gercep umma??????????????,3,@luvvleyysevvb,FALSE,FALSE,FALSE,FALSE,,FALSE,
1 month ago,Aseek masak masak bareng adik?,3,@irinetitin2104,FALSE,FALSE,FALSE,FALSE,,FALSE,
1 month ago,yeayy pas bgt mau mam umma upload ????,3,@kunikharviyya8154,FALSE,FALSE,FALSE,FALSE,,FALSE,
1 month ago,Gercepp ummaaa,3,@paramitaputrikusuma7781,FALSE,FALSE,FALSE,FALSE,,FALSE,
1 month ago,Mana tim gercep umma Mega,3,@syifa3519,FALSE,FALSE,FALSE,FALSE,,FALSE,
1 month ago,Waalaikumssalam umma dan ritttt,3,@devialfiyah32,FALSE,FALSE,FALSE,FALSE,,FALSE,
1 month ago,gercep umma,3,@NnCell-u6w,FALSE,FALSE,FALSE,FALSE,,FALSE,
1 month ago,jujur mama Mega cantik banget Masya Allah apalagi pas senyum,3,@NanaWhossly,FALSE,FALSE,FALSE,FALSE,,FALSE,
1 month ago,Cameramen mama siapa????,3,@mdabakr1790,FALSE,FALSE,FALSE,FALSE,,FALSE,
1 month ago,Jernih banget glowing jadinya ...,3,@MATAIJOOO,FALSE,FALSE,FALSE,FALSE,,FALSE,
1 month ago,"ih bagus banget ummaa kameranyaa ?, semangat ya uma bikin videoo, aku gapunya sosok mama sama papa di hidup aku nonton mama mega seneng sendiri, kita di belakang layar merasa di urus dan di sayangi oleh umaa, makasi ya uma udah ngeserep air mata aku pas nangis, kesedihanku pas ada musibah, semoga rezeki mma ter lipat lipat uma lovyuuu",3,@hamribble,FALSE,FALSE,FALSE,FALSE,,FALSE,
1 month ago (edited),"Gapapa mama, kami yang WARAS² ini sangat memaklumi kalo videonya masih ada efek² yg bikin gerak² begini?, SEMUA BERPROSES ya maa, mama juga pasti pas upload udah kerasa ini hasil videonya begink.. pasti nanti kedepannya makin pinter pake kameranya ya umma???",3,@adkrrm,FALSE,FALSE,FALSE,FALSE,,FALSE,
1 month ago (edited),"Tim gercepppp
Semangat umma sama adik ritsukiii",2,@iqlimadara,FALSE,FALSE,FALSE,FALSE,,FALSE,
1 month ago,gercep ummaaa,2,@sekarayu-gm7vh,FALSE,FALSE,FALSE,FALSE,,FALSE,
1 month ago,Gercep....,2,@diahwuryaningsih07,FALSE,FALSE,FALSE,FALSE,,FALSE,
1 month ago,gercep nih ummaaa,2,@AlyshaMiraj,FALSE,FALSE,FALSE,FALSE,,FALSE,
1 month ago,gercep ni umma,2,@KEYSHAAULIAPUTRI-kv4vu,FALSE,FALSE,FALSE,FALSE,,FALSE,
1 month ago,Gercep umma??,2,@ZakiaArief-f9w,FALSE,FALSE,FALSE,FALSE,,FALSE,
1 month ago,Gercep umma??,2,@DivaFebriana-f8v,FALSE,FALSE,FALSE,FALSE,,FALSE,
1 month ago,gercep ummaaa?,2,@ListyaImanun,FALSE,FALSE,FALSE,FALSE,,FALSE,
1 month ago,Waalaikumsalam ritsuki n umma?,2,@luciwati2946,FALSE,FALSE,FALSE,FALSE,,FALSE,
1 month ago,Gercep nih umma,2,@MaksudnyaDia-ye7em,FALSE,FALSE,FALSE,FALSE,,FALSE,
1 month ago,Langsung gercep nih umma,2,@Queenza_CH,FALSE,FALSE,FALSE,FALSE,,FALSE,
1 month ago,gercep nih umma ?,2,@hwachaewon,FALSE,FALSE,FALSE,FALSE,,FALSE,
1 month ago,Gerceppp abiezzz??????,2,@florabungaindaha.3737,FALSE,FALSE,FALSE,FALSE,,FALSE,
1 month ago,"Umma kameranya kenapa?, kok videonya jadi bergelombang gitu?",2,@trihanawulandari3066,FALSE,FALSE,FALSE,FALSE,,FALSE,
1 month ago,gercepp bestie??????,2,@RaisaRahma-ng9ni,FALSE,FALSE,FALSE,FALSE,,FALSE,
1 month ago,Umaa kayaknya kameranya harus di atur lagi de warnanya agak kuning,2,@Cantikkkkkkj,FALSE,FALSE,FALSE,FALSE,,FALSE,
1 month ago,Teruss kayak kembang kempis gituu,0,@Cantikkkkkkj,TRUE,FALSE,FALSE,FALSE,,FALSE,
1 month ago,Timm gercep nihh umma??????,2,@amellyaaugustin724,FALSE,FALSE,FALSE,FALSE,,FALSE,
1 month ago,kok mleyot2 yak vidionya????,2,@buttaerflye,FALSE,FALSE,FALSE,FALSE,,FALSE,
1 month ago,"Gambarnya bagus bgt tapi kok kaya bergelombang"" ngono yah apa mata q aja yg liat",2,@panuntun3576,FALSE,FALSE,FALSE,FALSE,,FALSE,
1 month ago,Lebih baik ngajakin anak masak daripada pegang hp terus ya umma ?,2,@wahyufitrotun3833,FALSE,FALSE,FALSE,FALSE,,FALSE,
1 month ago,video nya kaya sedikit gelombang gitu ga sih?,2,@najwa2287,FALSE,FALSE,FALSE,FALSE,,FALSE,
1 month ago,"Gercepp, dapet ritsuki gak nih??",2,@FikaSri-ep3bo,FALSE,FALSE,FALSE,FALSE,,FALSE,
1 month ago,"Pokoknya hari""full nonton Chanel mama Mega klo gk nonton rasanya kek ada yg kurang??",2,@resalestari2297,FALSE,FALSE,FALSE,FALSE,,FALSE,
1 month ago,kameramen uma siapa ya!??,2,@ikachan2607,FALSE,FALSE,FALSE,FALSE,,FALSE,
1 month ago,kameramen nya umma siapa sih??????,2,@dlmel_n4330,FALSE,FALSE,FALSE,FALSE,,FALSE,
1 month ago,iyaa gw juga kepo,2,@user-nz8nu7ll4p,TRUE,FALSE,FALSE,FALSE,,FALSE,
1 month ago,SBY hadir umma Mega aq paling seneng ngliat Ritsuki sama Natsuki anaknya pinter apalagi klo Ritsuki matanya mlerok lucuuuu bngt anaknya cantik Umma Mega pinter didiknya gak lupa sama bhsa daerahnya Tulungagung . Apalagi klo bilang eling to Rit....??????????,2,@yanimarkoem2002,FALSE,FALSE,FALSE,FALSE,,FALSE,
1 month ago,Ummaaa tiap video lg masak aku selalu kepengen dan lgsg nyari makanan yg umma masak . Klo gini kan jd gagal diet ummaa,2,@aprillahashariputri2457,FALSE,FALSE,FALSE,FALSE,,FALSE,
1 month ago,Andai di desaku tahune seperti itu mameg pasti lega banget maem e ??,2,@Dwikumala99,FALSE,FALSE,FALSE,FALSE,,FALSE,
1 month ago,Efek kamera nya mungkin ya ritsuki jadi gepeng?? ??,2,@Alicefams,FALSE,FALSE,FALSE,FALSE,,FALSE,
1 month ago,Loohh kirain bi ikah????,2,@nurhayatidewi4743,FALSE,FALSE,FALSE,FALSE,,FALSE,
1 month ago,bagus bangeett kualitas videonyaa jadi tambah puas nontonnyaaa,2,@revalinawahyusaktiesapurna6972,FALSE,FALSE,FALSE,FALSE,,FALSE,
1 month ago,Kameramen umma gak eling nyuting nya muka umma terus gorengan nya ga keliatan??,2,@Ayahibuqeen1529,FALSE,FALSE,FALSE,FALSE,,FALSE,
1 month ago,Baguss umma kameranya bening polll kyak wajahe umma,2,@Larasatiaayu,FALSE,FALSE,FALSE,FALSE,,FALSE,
1 month ago,Uma sprtinya itu face tracking nya aktif. Di off aja uma ??,2,@riuhangindiluar,FALSE,FALSE,FALSE,FALSE,,FALSE,
1 month ago,SEBELUM BERANGKAT SEKOLAH NONTON DULUUUI,2,@sakurasimulator9102,FALSE,FALSE,FALSE,FALSE,,FALSE,
1 month ago,Kemeramen nya siapa itu,2,@selviasilvia879,FALSE,FALSE,FALSE,FALSE,,FALSE,
1 month ago,"Hd bgt oi videonya, minusnya gelombang"" aja ummaa,tapi udah bguss bangett",2,@apriliawulandari7011,FALSE,FALSE,FALSE,FALSE,,FALSE,
1 month ago,"Si botol Yakult, peningkat mood dikala lg,kurang mood.
Terimakasih videonya umma mega.
Semoga selalu sehat ueno family.",2,@xydintan_7104,FALSE,FALSE,FALSE,FALSE,,FALSE,
1 month ago,Pertama umma??,1,@ReissaElvaretta-hs4sx,FALSE,FALSE,FALSE,FALSE,,FALSE,
1 month ago,Pertama??,1,@kayl236,FALSE,FALSE,FALSE,FALSE,,FALSE,
1 month ago,Alah gw yang pertama jg??,0,@aayonly5196,TRUE,FALSE,FALSE,FALSE,,FALSE,
1 month ago,GERCEPPP,1,@mandaaakylas_,FALSE,FALSE,FALSE,FALSE,,FALSE,
1 month ago,Gercep,1,@alice.zepeto6242,FALSE,FALSE,FALSE,FALSE,,FALSE,
1 month ago,pertamaaa????,1,@Derazaa,FALSE,FALSE,FALSE,FALSE,,FALSE,
1 month ago,Tim gercep uma nihhh????,1,@Aura_12N,FALSE,FALSE,FALSE,FALSE,,FALSE,
1 month ago,Salfok suara nya kameramen nya,0,@Aura_12N,TRUE,FALSE,FALSE,FALSE,,FALSE,
1 month ago,?????????,1,@selpidilla,FALSE,FALSE,FALSE,FALSE,,FALSE,
1 month ago,Tim gercep umma??,1,@nurlaelaningsih-r8o,FALSE,FALSE,FALSE,FALSE,,FALSE,
1 month ago,Aaa gemes banget,1,@JuniNurrohma,FALSE,FALSE,FALSE,FALSE,,FALSE,
1 month ago,Gercep uma,1,@Vforrvia,FALSE,FALSE,FALSE,FALSE,,FALSE,
1 month ago,Tim gercep mana nih,1,@PutriRegina-l7x,FALSE,FALSE,FALSE,FALSE,,FALSE,
1 month ago,Yang ditunggu2 ??????,1,@Sintiams,FALSE,FALSE,FALSE,FALSE,,FALSE,
1 month ago,"pertama nihh absen dlu
????",1,@putrisabrina1926,FALSE,FALSE,FALSE,FALSE,,FALSE,
1 month ago (edited),Pertama umma dapet apa,1,@shaqila10,FALSE,FALSE,FALSE,FALSE,,FALSE,
1 month ago,Tim gercep,1,@IDSMall-yq2bn,FALSE,FALSE,FALSE,FALSE,,FALSE,
1 month ago,tim gercep umma,1,@akilarifahs,FALSE,FALSE,FALSE,FALSE,,FALSE,
1 month ago,Gercep mameggg,1,@shngrc31,FALSE,FALSE,FALSE,FALSE,,FALSE,
1 month ago,yeayyyy sebelumk ribuann?,1,@HairaMaulidya,FALSE,FALSE,FALSE,FALSE,,FALSE,
1 month ago,Tim Gercep liat ketidak elingan keluarga ini ??,1,@dwinuryanti4590,FALSE,FALSE,FALSE,FALSE,,FALSE,
1 month ago,Gercep uma,1,@RihadatulAisahMaesaroh,FALSE,FALSE,FALSE,FALSE,,FALSE,
1 month ago,Gerceppppp??,1,@user-th9jy3em2q,FALSE,FALSE,FALSE,FALSE,,FALSE,
1 month ago,gercep umma,1,@agstnw,FALSE,FALSE,FALSE,FALSE,,FALSE,
1 month ago,YEAYY KBTULAN PAS MAKAN SIANG???,1,@Jhonyymyhusband,FALSE,FALSE,FALSE,FALSE,,FALSE,
1 month ago,Gercep umma,1,@Niscao,FALSE,FALSE,FALSE,FALSE,,FALSE,
1 month ago,Garcep????,1,@dedetalita-b3e,FALSE,FALSE,FALSE,FALSE,,FALSE,
1 month ago,Rittttttttttttttttttttttttttttttttttttttttttttttttttttttttttttttttttttttttttttttttt,1,@IkeRatnaDewiputri,FALSE,FALSE,FALSE,FALSE,,FALSE,
1 month ago,Waduhh telatt satu menit ??,1,@JeniSerelenia,FALSE,FALSE,FALSE,FALSE,,FALSE,
1 month ago,Semangat mameg dan keluarga?,1,@AlNisa-fd1cf,FALSE,FALSE,FALSE,FALSE,,FALSE,
1 month ago,akhirnya yg ditunggu tunggu??????,1,@dianawahyuningrum8673,FALSE,FALSE,FALSE,FALSE,,FALSE,
1 month ago,gercep nih uma,1,@tianwiji3925,FALSE,FALSE,FALSE,FALSE,,FALSE,
1 month ago,lucu bgtt rambut nya ritsukiii ????????,1,@sh_belle,FALSE,FALSE,FALSE,FALSE,,FALSE,
1 month ago,umma kamera nyaa kayak bergelombang gt loh apa lensa nya yaa kek agak gmn gt????,1,@micatshay,FALSE,FALSE,FALSE,FALSE,,FALSE,
1 month ago,Kameranya gak bagus umaa,1,@yosefa1064,FALSE,FALSE,FALSE,FALSE,,FALSE,
1 month ago,100000000000 orang tercepat,1,@adhioFathan,FALSE,FALSE,FALSE,FALSE,,FALSE,
1 month ago,Kurang gercep ?????????,1,@ReniSeptiani-o2s,FALSE,FALSE,FALSE,FALSE,,FALSE,
1 month ago,Team yang nonton sambil mbadogggggg mana suaranya??,1,@yonmachannel,FALSE,FALSE,FALSE,FALSE,,FALSE,
1 month ago,TIM GERCEP SINII,1,@sarafebriyanti5027,FALSE,FALSE,FALSE,FALSE,,FALSE,
1 month ago,Yahh Suzuki udah elingg????,1,@Xyyy_raa,FALSE,FALSE,FALSE,FALSE,,FALSE,
1 month ago,"Pokoknya kalo nonton vlog keluarga ini harus nyiapin makanan juga, krna pasti laper bawaannya...??",1,@reszaseptiani7332,FALSE,FALSE,FALSE,FALSE,,FALSE,
1 month ago,tim gercep nya umma,1,@itzzmyfaa_321,FALSE,FALSE,FALSE,FALSE,,FALSE,
1 month ago,Hasil video nya kok gede kecil gede kecil gitu ya umaaaa,1,@lydiaratnawijaya3371,FALSE,FALSE,FALSE,FALSE,,FALSE,
1 month ago,Ritsuki masukin micin bnyk bngtt??,1,@PipitPutriHendrawati,FALSE,FALSE,FALSE,FALSE,,FALSE,
1 month ago,Tim gercep umma,1,@makrufnia1380,FALSE,FALSE,FALSE,FALSE,,FALSE,
1 month ago,"Makk, ni videonya kaya bergelombang gitu yaa? Gak kayaa biasanyaa",1,@eufemiahaning530,FALSE,FALSE,FALSE,FALSE,,FALSE,
1 month ago (edited),"Kok gambar  dilayar ky bergelombang klo pas gerak uma?.. opo cm hp q ? Pdhl aq seneng video mameg yg apa adanya tanpa cut. Selamat datang om ahmad, jd kameramen Ueno Family",1,@asrirachmawati3276,FALSE,FALSE,FALSE,FALSE,,FALSE,
1 month ago,Videonya kaya ada gelombang air air gitu umma ??,1,@hanayulina,FALSE,FALSE,FALSE,FALSE,,FALSE,
1 month ago,Pasti uma coba kamera barunya,1,@junitakartikasari,FALSE,FALSE,FALSE,FALSE,,FALSE,
1 month ago,Umaa filternya bikin aneh dikit karena meleyot meleyot,1,@yoo_hobin294,FALSE,FALSE,FALSE,FALSE,,FALSE,
1 month ago,Kameranya kek goyang2 gak sih. Kek efeknya,1,@megimelasari,FALSE,FALSE,FALSE,FALSE,,FALSE,
1 month ago,Uma siapa yg megan kamera nya,1,@MutiaraMariska,FALSE,FALSE,FALSE,FALSE,,FALSE,
1 month ago,"Iya pnasaran, kayak orang indonesia",0,@AmiraPutri-yv1gs,TRUE,FALSE,FALSE,FALSE,,FALSE,
1 month ago, @AmiraPutri-yv1gs  iy,0,@MutiaraMariska,TRUE,FALSE,FALSE,FALSE,,FALSE,
1 month ago (edited),"Uma kualitas videonya kurang jernih, ngga kayak biasanya",1,@youcando4431,FALSE,FALSE,FALSE,FALSE,,FALSE,
1 month ago,kok videonya bergelombang gitu ya umma? ????,1,@loufiesdifts,FALSE,FALSE,FALSE,FALSE,,FALSE,
1 month ago,Uma bikin dimsum,1,@seviapuspitasari4945,FALSE,FALSE,FALSE,FALSE,,FALSE,
1 month ago,Umaa video nya kenapa kyak dipake filter melengkung2 gituu??,1,@leilylaurentia5892,FALSE,FALSE,FALSE,FALSE,,FALSE,
1 month ago,"kayaknya ada yang salah dari kameranya deh mama meg, apa pasang lensa 0,5 nya kurang pas yaaa? agak gelombang gitu soalnya??",1,@nothing2222,FALSE,FALSE,FALSE,FALSE,,FALSE,
1 month ago,Bukan penonton pertama tapi penonton setia umma mega??,1,@Falya_ID,FALSE,FALSE,FALSE,FALSE,,FALSE,
1 month ago,"Malah kayak pake filter umma, jadi penyok penyok gitu. Mending hp, kalau ini pusing",1,@anonym6880,FALSE,FALSE,FALSE,FALSE,,FALSE,
1 month ago,"banyak mau, kemarin aja disuruh nyoba kameranya, maklumlah baru pertama kali nyoba settingan nya juga mungkin belum ngerti.",0,@vaniaagustinarismayanti12,TRUE,FALSE,FALSE,FALSE,,FALSE,
1 month ago,"Kameranya kaya agak aneh umma, tengahnya bengkok2 gitu, bagus pakai hp",1,@ratnadewipamungkas4862,FALSE,FALSE,FALSE,FALSE,,FALSE,
1 month ago,Layarnya cenat cenut uma,1,@NisaWulandari-bo3wc,FALSE,FALSE,FALSE,FALSE,,FALSE,
1 month ago,Grecep umma,1,@alyaayla-ht7zl,FALSE,FALSE,FALSE,FALSE,,FALSE,
1 month ago,Gelembung atau apa ini dikamera baru ganggu banget umaa,1,@riskaoktaviana2891,FALSE,FALSE,FALSE,FALSE,,FALSE,
1 month ago (edited),"The Ueno Family (Mama Mega, Papa Bambang ""Kenichiro san"", Kakak Natsuki, & Dedek Ritsuki) minta collabs sama Haruka Nakagawa (Artis Jepang ???? yang terkenal di Indonesia ????) bagian konten vlog Tottori di YouTube channel Ueno Family Japan

Halo Bestie, Assalamualaikum Konnichiwa",1,@nabillahegiasa9964,FALSE,FALSE,FALSE,FALSE,,FALSE,
1 month ago,Hasil kameranya bergelombang umma,1,@abiyoga01,FALSE,FALSE,FALSE,FALSE,,FALSE,
1 month ago,umma setingan kameranyaaa??????????,1,@viccavr,FALSE,FALSE,FALSE,FALSE,,FALSE,
1 month ago,"Uma video nya kaya bergelombang gitu, pusinggg ??",1,@depisusanti8884,FALSE,FALSE,FALSE,FALSE,,FALSE,
1 month ago,"tapi yang Semarang goyang2 situ, Kenya ada filternya deh, liatnya jdi g plongg wkwk",1,@putrimaalikafebrina7953,FALSE,FALSE,FALSE,FALSE,,FALSE,
1 month ago,uma videonya bergelombang??,1,@anisaa9801,FALSE,FALSE,FALSE,FALSE,,FALSE,
1 month ago,Ko layarnya jdi meleyot meleyot gtu umma?,1,@RinaNurjanah-z4s,FALSE,FALSE,FALSE,FALSE,,FALSE,
1 month ago,Ciyeee kamera baruu natrits??????,1,@RizekiBasuki,FALSE,FALSE,FALSE,FALSE,,FALSE,
1 month ago,tim gercep sini kumpul??????,1,@isnaniayustidar5301,FALSE,FALSE,FALSE,FALSE,,FALSE,
1 month ago,Bagus videonya umma pkai kamera ??,1,@dinidwi21,FALSE,FALSE,FALSE,FALSE,,FALSE,
1 month ago,ABSENNNNN,1,@ilaas13,FALSE,FALSE,FALSE,FALSE,,FALSE,
1 month ago,"akhirnya yang ditunggu-tunggu, sehat selalu umma dan sekeluarga ????",1,@user-rw2yw9dl3w,FALSE,FALSE,FALSE,FALSE,,FALSE,
1 month ago,tim gercepp,1,@najwakarisma1197,FALSE,FALSE,FALSE,FALSE,,FALSE,
1 month ago,kok di hpku videonya ngeglitch ya?,1,@salwafaradisa3597,FALSE,FALSE,FALSE,FALSE,,FALSE,
1 month ago,Dihp semua orang.kaya melengkung2 gerak gerak??,0,@zeefairy,TRUE,FALSE,FALSE,FALSE,,FALSE,
1 month ago,umma vidionya makin jernih,1,@nashihatussholihah9436,FALSE,FALSE,FALSE,FALSE,,FALSE,
1 month ago,Timm yng sukaaa bngtt ama ueno familyy,1,@khall_13,FALSE,FALSE,FALSE,FALSE,,FALSE,
1 month ago,"Wah vlognya pake camera yg baru di beli yah umma ???? agak beda tampilannya kaya melengkung bergelombang hasil videonya, tp gapapa nanti di setting lg ya umma wajar baru ke pake ??",1,@ciciphutryg,FALSE,FALSE,FALSE,FALSE,,FALSE,
1 month ago,"moodbooster ku mama mega dan anak2,",1,@meirindratrisnatuti854,FALSE,FALSE,FALSE,FALSE,,FALSE,
1 month ago,Itu coper umma bukan blender???? 3:59,1,@andhikacely2747,FALSE,FALSE,FALSE,FALSE,,FALSE,
1 month ago,Jernih banget umma kameranenya??,1,@Ginnut,FALSE,FALSE,FALSE,FALSE,,FALSE,
1 month ago,kameramen nya ganteng umma??,1,@rastt111,FALSE,FALSE,FALSE,FALSE,,FALSE,
1 month ago,Tim gercep,1,@a3i870,FALSE,FALSE,FALSE,FALSE,,FALSE,
1 month ago,kenapa lebih suka vlog umma sendiri g pke kameramen lebih natural??????,1,@SuciMaharani-ur6bl,FALSE,FALSE,FALSE,FALSE,,FALSE,
1 month ago,yeyyyyyy upload ??????????????????????????,1,@yyyyyyy1519,FALSE,FALSE,FALSE,FALSE,,FALSE,
1 month ago,Tim grecep mana nihhh??,1,@user-rx7cy2hf6z,FALSE,FALSE,FALSE,FALSE,,FALSE,
1 month ago,Gercep nih umma,1,@zahraaurellia6205,FALSE,FALSE,FALSE,FALSE,,FALSE,
1 month ago,Jadi suka sama keluarga ini ??????,1,@etytiyas4673,FALSE,FALSE,FALSE,FALSE,,FALSE,
1 month ago,ini yg jdi cameraman sapo ?,1,@vvfifyy,FALSE,FALSE,FALSE,FALSE,,FALSE,
1 month ago,"bagus bgt umma kameranya, beda bgt sm kamera hp. saranku lanjutin pake dji osmo. soale kualitas videonya mantep. skrng mungkin blm terbiasa, nnti lama² pasti lebih luwes pake kamera dji osmonya hehe.
 trs kalo bisa umma konsistenin pake thumbnail disetiap vlog biar menarik dan cantik?? semongko????",1,@flovi1378,FALSE,FALSE,FALSE,FALSE,,FALSE,
1 month ago,Kameramen mama orang baru??,1,@fharadiitaputriherlanda4983,FALSE,FALSE,FALSE,FALSE,,FALSE,
1 month ago,"umma mungkin karna pake lensa yang wide jadi kualitas videonya melengkung. kalau didalam rumah, mungkin pake lensa biasa aja umma. kalo untuk diluar baru pake lensa wide",1,@monmirin,FALSE,FALSE,FALSE,FALSE,,FALSE,
1 month ago,Jadi yg ngaamera iki yusuke?? BIYUH GAK BAHAYA TA??????????,1,@QorinMurdayan,FALSE,FALSE,FALSE,FALSE,,FALSE,
1 month ago,"bukan , ini yg rekam om ahmad",0,@doona99,TRUE,FALSE,FALSE,FALSE,,FALSE,
1 month ago, @doona99  siapae uma,0,@QorinMurdayan,TRUE,FALSE,FALSE,FALSE,,FALSE,
1 month ago,Aku jadi pengen deh ??,1,@ana012-iz7wt,FALSE,FALSE,FALSE,FALSE,,FALSE,
1 month ago,kameramen nya cakep,1,@Alowantoy,FALSE,FALSE,FALSE,FALSE,,FALSE,
1 month ago,suaranya kameramenya siapa nmy umma,1,@wiennajihanchanel2556,FALSE,FALSE,FALSE,FALSE,,FALSE,
1 month ago,yg ditunggu tunggu,1,@anaaynell,FALSE,FALSE,FALSE,FALSE,,FALSE,
1 month ago,Semangat 2 jt subscribe uma,1,@mkhabulabubakar6088,FALSE,FALSE,FALSE,FALSE,,FALSE,
1 month ago,3:15  Mencret ??,1,@ffu25-ffuffu,FALSE,FALSE,FALSE,FALSE,,FALSE,
1 month ago,Gak sabar nunggu vlog uma cari gani gani??,1,@user-dinisendiri,FALSE,FALSE,FALSE,FALSE,,FALSE,
1 month ago,"Mungkin settingan kamera nya ya umma, coba di ulik lagi lihat2 tutorial di youtube?? tapi kamera ini bagus banget lebih jernih dan cerah",1,@lattechocolate7450,FALSE,FALSE,FALSE,FALSE,,FALSE,
1 month ago,umaa siapaa yang pegangin kameraa??,1,@f4iryvyy,FALSE,FALSE,FALSE,FALSE,,FALSE,
1 month ago,"kameranya gambarnya jernih dan terang juga, cuman mungkin perlu di setting lagi",1,@adiesadiba,FALSE,FALSE,FALSE,FALSE,,FALSE,
1 month ago,Klo aku tahu isi GK tau ya suka aja klo isinya bihun,1,@nonikareksuroboyo6544,FALSE,FALSE,FALSE,FALSE,,FALSE,
1 month ago,Anak micin ya Rit.. ??????,1,@Enno_As,FALSE,FALSE,FALSE,FALSE,,FALSE,
1 month ago,Umma flok nya lagi judul nya ap,1,@andrikrere5648,FALSE,FALSE,FALSE,FALSE,,FALSE,
1 month ago,"kameranya jadi bagus jernih banget umma?? cuma mungkin belum
terbiasa aja, semangat belajar umma mega????",1,@happiestgirl9690,FALSE,FALSE,FALSE,FALSE,,FALSE,
1 month ago,Umma mega punya kameramen?,1,@aliyasyarefa,FALSE,FALSE,FALSE,FALSE,,FALSE,
1 month ago,"itu kameramennya siapa  kok om om,,itu om yusuke kah / siapa?",1,@safaaaa2610,FALSE,FALSE,FALSE,FALSE,,FALSE,
1 month ago,"uma camera baru, bagus bangett!!",1,@syiffarayshesa6398,FALSE,FALSE,FALSE,FALSE,,FALSE,
1 month ago,"Ritsukii : singkat, padat, jelas ""mencret om?"" Wkwkw",1,@resimarselia7446,FALSE,FALSE,FALSE,FALSE,,FALSE,
1 month ago,VIDEO NYA BESAR KECIL BESAR KECIL GITUU UMAAAA ??????,1,@rssrrsrs,FALSE,FALSE,FALSE,FALSE,,FALSE,
1 month ago,umma udah punya kameramen ya sekarang ???,1,@FaridaAmanda-zq4se,FALSE,FALSE,FALSE,FALSE,,FALSE,
1 month ago,"sumpahh videonya jernih bangett, enak di lihat",1,@winterm.z,FALSE,FALSE,FALSE,FALSE,,FALSE,
1 month ago,Yg syuting siapa mama mega?,1,@RenataDwi-sk7fb,FALSE,FALSE,FALSE,FALSE,,FALSE,
1 month ago,"Kameramen ne ojo gor meneng ae to ma kon ngomong juga kon takok"" ngono kon interasik ngono loh nakok""i mama mega",1,@deditriono8155,FALSE,FALSE,FALSE,FALSE,,FALSE,
1 month ago,"Umma cmiiw kalo ga salah pake chopper itu biar ga gampang rusak mencetnya bentar2 kaya 3 detik, trs 3 detik lagi trs baru boleh agak lama",1,@izzafahriza2232,FALSE,FALSE,FALSE,FALSE,,FALSE,
1 month ago,"Mas Natsuki SAID : TAPI GAK BISA DATANG
WKWKWKWKWKWKWKKK",1,@evitamba,FALSE,FALSE,FALSE,FALSE,,FALSE,
1 month ago,Umma coba buat tempe??,1,@Alya_nurrahmadani,FALSE,FALSE,FALSE,FALSE,,FALSE,
1 month ago,"Kayae kamerane sama dengan Mikiya..  kl waktunya cocok n sama2 berkenan,  collab live bareng  dia ngomongin setting kamera bisa jadi konten, Umma",1,@rahmahanifa5505,FALSE,FALSE,FALSE,FALSE,,FALSE,
1 month ago,Lucu banget ritsuki ??,1,@itsoktaviaa,FALSE,FALSE,FALSE,FALSE,,FALSE,
1 month ago,semangattt pelajarin kameranya ummaaa semogga segera jadi prooo cameramen ????,1,@cupidp,FALSE,FALSE,FALSE,FALSE,,FALSE,
1 month ago,uma kameranya bagus loh lebih cerahhh??,1,@lutfiana9213,FALSE,FALSE,FALSE,FALSE,,FALSE,
1 month ago,yg jdi kameramen nya siapa yaaa??,1,@atiraparamani,FALSE,FALSE,FALSE,FALSE,,FALSE,
1 month ago,4:18  MENCRET,1,@ffu25-ffuffu,FALSE,FALSE,FALSE,FALSE,,FALSE,
1 month ago,Umma ada om kameramen baru yaa,1,@tamaramaretsa816,FALSE,FALSE,FALSE,FALSE,,FALSE,
1 month ago,fixx sih bulan depan 2juta subscribe??,1,@rizkiirawan8848,FALSE,FALSE,FALSE,FALSE,,FALSE,
1 month ago,Lebih prefer kalo kameranya ditaruh Uma ??,1,@amaliaseptia3981,FALSE,FALSE,FALSE,FALSE,,FALSE,
1 month ago,Yang megang kamera siyapa si?,1,@user-tk2cd3zt5x,FALSE,FALSE,FALSE,FALSE,,FALSE,
